{
  "coverage": {
    "end_ticks": 180000,
    "start_ticks": 0
  },
  "schema_version": "clipmill.media.reference_index.v1",
  "source_fingerprint": "sha256:31ab000000000000000000000000000000000000000000000000000000000006",
  "streams": [
    {
      "duration_ticks": 180000,
      "index": 0,
      "kind": "video",
      "packet_count": 60
    },
    {
      "duration_ticks": 180000,
      "index": 1,
      "kind": "audio",
      "packet_count": 94
    }
  ],
  "video_keyframes": [
    {
      "byte_pos": 48,
      "pts_ticks": 0,
      "stream_index": 0
    },
    {
      "byte_pos": 91444,
      "pts_ticks": 90090,
      "stream_index": 0
    }
  ]
}
